{
  "$schema": "portfolio-results-v3.schema.json",
  "schema_version": "3.0",
  "protocol_id": "zju-portfolio-twenty-skill-v3",
  "run_id": "l1-contract-census-v1.0.0",
  "skill_commit": "ee5c2736344015f707519994735febb97ed22a9f",
  "protocol_sha256": "fa0506bed6c6e890e31ec7d87190548307f7517b078d9b1c93730855cb0ec67e",
  "capability_matrix_sha256": "e0a7327863f2b654cef67f738bbceadc96e8b5857c933358a8efd871d85269ee",
  "run_manifest_sha256": null,
  "baseline_selection": {},
  "rater_precommit": null,
  "holdout_declaration": {
    "frozen": false,
    "unseen": false,
    "first_attempt": false,
    "independent_administration": false,
    "lock_sha256": null,
    "case_document_sha256": null,
    "case_fingerprints_sha256": null,
    "first_attempt_registry_sha256": null,
    "allocation_commitment_sha256": null,
    "allocation_reveal_sha256": null,
    "independent_administration_attestation_sha256": null
  },
  "protocol_deviations": [],
  "records": [
    {
      "skill_id": "zju-literature-search",
      "layer": "L1_contract_conformance",
      "case_id": "skill_format",
      "stratum": "release_census",
      "capability_ids": [],
      "passed": true,
      "critical_failure": false,
      "run_id": "l1-contract-census-v1.0.0",
      "skill_commit": "ee5c2736344015f707519994735febb97ed22a9f",
      "protocol_sha256": "fa0506bed6c6e890e31ec7d87190548307f7517b078d9b1c93730855cb0ec67e",
      "capability_matrix_sha256": "e0a7327863f2b654cef67f738bbceadc96e8b5857c933358a8efd871d85269ee",
      "case_fingerprint": "73b134d304975c36f7637fac0848bc661fbaecc0814dd2c2624940fee7dcdf27",
      "evidence_sha256": "0b41bb52dc2fb2fb91d55194ab47aa810ae465a5293ca75f4d0f20a21827896e"
    },
    {
      "skill_id": "zju-literature-search",
      "layer": "L1_contract_conformance",
      "case_id": "trigger_boundary",
      "stratum": "release_census",
      "capability_ids": [],
      "passed": true,
      "critical_failure": false,
      "run_id": "l1-contract-census-v1.0.0",
      "skill_commit": "ee5c2736344015f707519994735febb97ed22a9f",
      "protocol_sha256": "fa0506bed6c6e890e31ec7d87190548307f7517b078d9b1c93730855cb0ec67e",
      "capability_matrix_sha256": "e0a7327863f2b654cef67f738bbceadc96e8b5857c933358a8efd871d85269ee",
      "case_fingerprint": "c740239e1bb35ef504a74e4bb245db87a174c26fb79893166f8dadccc55506ac",
      "evidence_sha256": "aa0d63f7657e16367683f2f2eb08d2c414aa708bd2ad29dcd6207df186d2e3ed"
    },
    {
      "skill_id": "zju-literature-search",
      "layer": "L1_contract_conformance",
      "case_id": "resource_resolution",
      "stratum": "release_census",
      "capability_ids": [],
      "passed": true,
      "critical_failure": false,
      "run_id": "l1-contract-census-v1.0.0",
      "skill_commit": "ee5c2736344015f707519994735febb97ed22a9f",
      "protocol_sha256": "fa0506bed6c6e890e31ec7d87190548307f7517b078d9b1c93730855cb0ec67e",
      "capability_matrix_sha256": "e0a7327863f2b654cef67f738bbceadc96e8b5857c933358a8efd871d85269ee",
      "case_fingerprint": "47c510e8794cd689372250b319f9d9e7fa50dd7e38038262c6055825919e63bf",
      "evidence_sha256": "027cfa7423abbea4fa648dc2cd27c793b1a1272790e15f2cc1d185fc4e4345c0"
    },
    {
      "skill_id": "zju-literature-search",
      "layer": "L1_contract_conformance",
      "case_id": "output_contract",
      "stratum": "release_census",
      "capability_ids": [],
      "passed": true,
      "critical_failure": false,
      "run_id": "l1-contract-census-v1.0.0",
      "skill_commit": "ee5c2736344015f707519994735febb97ed22a9f",
      "protocol_sha256": "fa0506bed6c6e890e31ec7d87190548307f7517b078d9b1c93730855cb0ec67e",
      "capability_matrix_sha256": "e0a7327863f2b654cef67f738bbceadc96e8b5857c933358a8efd871d85269ee",
      "case_fingerprint": "0098b3418efd01620c04e01a8cd12365142dcd2e477dbb20924b394fb3ada0f1",
      "evidence_sha256": "832744b2c5d0293cd99bc562851a5265516aa69621fdefbda2c871927509161d"
    },
    {
      "skill_id": "zju-literature-search",
      "layer": "L1_contract_conformance",
      "case_id": "provenance_license",
      "stratum": "release_census",
      "capability_ids": [],
      "passed": true,
      "critical_failure": false,
      "run_id": "l1-contract-census-v1.0.0",
      "skill_commit": "ee5c2736344015f707519994735febb97ed22a9f",
      "protocol_sha256": "fa0506bed6c6e890e31ec7d87190548307f7517b078d9b1c93730855cb0ec67e",
      "capability_matrix_sha256": "e0a7327863f2b654cef67f738bbceadc96e8b5857c933358a8efd871d85269ee",
      "case_fingerprint": "43462691ae3473f511450be8f6f8aff1ca870b8448d52303a2f11642d56982e2",
      "evidence_sha256": "7e7cd6743790b4a0ffd7d80eed519d2b79453f1ca732914a818c1cf63c464e87"
    },
    {
      "skill_id": "zju-literature-search",
      "layer": "L1_contract_conformance",
      "case_id": "evaluation_mapping",
      "stratum": "release_census",
      "capability_ids": [],
      "passed": true,
      "critical_failure": false,
      "run_id": "l1-contract-census-v1.0.0",
      "skill_commit": "ee5c2736344015f707519994735febb97ed22a9f",
      "protocol_sha256": "fa0506bed6c6e890e31ec7d87190548307f7517b078d9b1c93730855cb0ec67e",
      "capability_matrix_sha256": "e0a7327863f2b654cef67f738bbceadc96e8b5857c933358a8efd871d85269ee",
      "case_fingerprint": "33c2e04647fec1d0935dea13444323d6ef25a649477558ae4ae7a01c1814edcb",
      "evidence_sha256": "17507e7641e4aa2e53e3d86f9a886d81438c43759e9799254b82dadc91765cd6"
    },
    {
      "skill_id": "zju-fulltext-access",
      "layer": "L1_contract_conformance",
      "case_id": "skill_format",
      "stratum": "release_census",
      "capability_ids": [],
      "passed": true,
      "critical_failure": false,
      "run_id": "l1-contract-census-v1.0.0",
      "skill_commit": "ee5c2736344015f707519994735febb97ed22a9f",
      "protocol_sha256": "fa0506bed6c6e890e31ec7d87190548307f7517b078d9b1c93730855cb0ec67e",
      "capability_matrix_sha256": "e0a7327863f2b654cef67f738bbceadc96e8b5857c933358a8efd871d85269ee",
      "case_fingerprint": "8309dceb5b6f5b9d62618620bbeb4ee217369b74ebd54305acdcb47e4fb47104",
      "evidence_sha256": "6e27f637bbe320ae36b05f261a0502048e83d16a36c9135f5fb8c969130cdd67"
    },
    {
      "skill_id": "zju-fulltext-access",
      "layer": "L1_contract_conformance",
      "case_id": "trigger_boundary",
      "stratum": "release_census",
      "capability_ids": [],
      "passed": true,
      "critical_failure": false,
      "run_id": "l1-contract-census-v1.0.0",
      "skill_commit": "ee5c2736344015f707519994735febb97ed22a9f",
      "protocol_sha256": "fa0506bed6c6e890e31ec7d87190548307f7517b078d9b1c93730855cb0ec67e",
      "capability_matrix_sha256": "e0a7327863f2b654cef67f738bbceadc96e8b5857c933358a8efd871d85269ee",
      "case_fingerprint": "6abe5207b56a5ce41b29b13f27deb38c0576dd34d7e0b6d54fbc18934069a6cd",
      "evidence_sha256": "0e064176163e8ced1cbb97d5049c3d5fc043048679b1233dc060458a296a382a"
    },
    {
      "skill_id": "zju-fulltext-access",
      "layer": "L1_contract_conformance",
      "case_id": "resource_resolution",
      "stratum": "release_census",
      "capability_ids": [],
      "passed": true,
      "critical_failure": false,
      "run_id": "l1-contract-census-v1.0.0",
      "skill_commit": "ee5c2736344015f707519994735febb97ed22a9f",
      "protocol_sha256": "fa0506bed6c6e890e31ec7d87190548307f7517b078d9b1c93730855cb0ec67e",
      "capability_matrix_sha256": "e0a7327863f2b654cef67f738bbceadc96e8b5857c933358a8efd871d85269ee",
      "case_fingerprint": "acec1545b8569fc8b7ba30618d4a89796bdaf72bce9a6783a816fd07f951baf4",
      "evidence_sha256": "5ac143c919c660c5db9aa287fd210f9d7aa6a95d8b578806fccfca1e5bfa945e"
    },
    {
      "skill_id": "zju-fulltext-access",
      "layer": "L1_contract_conformance",
      "case_id": "output_contract",
      "stratum": "release_census",
      "capability_ids": [],
      "passed": true,
      "critical_failure": false,
      "run_id": "l1-contract-census-v1.0.0",
      "skill_commit": "ee5c2736344015f707519994735febb97ed22a9f",
      "protocol_sha256": "fa0506bed6c6e890e31ec7d87190548307f7517b078d9b1c93730855cb0ec67e",
      "capability_matrix_sha256": "e0a7327863f2b654cef67f738bbceadc96e8b5857c933358a8efd871d85269ee",
      "case_fingerprint": "cfd09171839e3e5f290cc27011960f6e6f95086a3034d346ea512aaec889c0b1",
      "evidence_sha256": "b8af09eafb9db6b094fa809e320d7714c6c36ab047a530aa489266b3e154c85b"
    },
    {
      "skill_id": "zju-fulltext-access",
      "layer": "L1_contract_conformance",
      "case_id": "provenance_license",
      "stratum": "release_census",
      "capability_ids": [],
      "passed": true,
      "critical_failure": false,
      "run_id": "l1-contract-census-v1.0.0",
      "skill_commit": "ee5c2736344015f707519994735febb97ed22a9f",
      "protocol_sha256": "fa0506bed6c6e890e31ec7d87190548307f7517b078d9b1c93730855cb0ec67e",
      "capability_matrix_sha256": "e0a7327863f2b654cef67f738bbceadc96e8b5857c933358a8efd871d85269ee",
      "case_fingerprint": "d7ebca958fc31d574f4b46f6f8ee82b45419dfed189f6d81883ba8455f15ebaf",
      "evidence_sha256": "8326bde28532900b0c00a65cc6b4ee25a7be25fd22def27e995f7ad1b217344f"
    },
    {
      "skill_id": "zju-fulltext-access",
      "layer": "L1_contract_conformance",
      "case_id": "evaluation_mapping",
      "stratum": "release_census",
      "capability_ids": [],
      "passed": true,
      "critical_failure": false,
      "run_id": "l1-contract-census-v1.0.0",
      "skill_commit": "ee5c2736344015f707519994735febb97ed22a9f",
      "protocol_sha256": "fa0506bed6c6e890e31ec7d87190548307f7517b078d9b1c93730855cb0ec67e",
      "capability_matrix_sha256": "e0a7327863f2b654cef67f738bbceadc96e8b5857c933358a8efd871d85269ee",
      "case_fingerprint": "eafb6eac7ea8ca55d0a15a0c34d5ba2496d3d0656820caae0c2ac2dae55eb478",
      "evidence_sha256": "4cb961b4c082d7b54c04ce33a572108a31663a91d3e782c5b2334ebf88568be6"
    },
    {
      "skill_id": "zju-reference-audit",
      "layer": "L1_contract_conformance",